{
  "$schema": "https://json-schema.org/draft/2020-12/schema",
  "$id": "https://forgerail.dev/schemas/provider-adapter-observation-v1.json",
  "title": "ForgeRail Provider Adapter Observation v1",
  "type": "object",
  "additionalProperties": false,
  "required": ["schemaVersion", "observationId", "adapterId", "adapterVersion", "providerId", "workspaceIdentityId", "sourceIdentityId", "scopeKind", "taskId", "subjectId", "controlRevisionId", "identity", "authorizationClaim", "capabilities", "observedAt", "sanitized"],
  "properties": {
    "schemaVersion": { "const": "1.0" },
    "observationId": { "type": "string", "pattern": "^[a-zA-Z0-9][a-zA-Z0-9._:-]+$" },
    "adapterId": { "type": "string", "pattern": "^[a-z][a-z0-9-]+$" },
    "adapterVersion": { "type": "string", "minLength": 1 },
    "providerId": { "type": "string", "pattern": "^[a-z][a-z0-9-]+$" },
    "workspaceIdentityId": { "type": "string", "pattern": "^[a-zA-Z0-9][a-zA-Z0-9._:-]+$" },
    "sourceIdentityId": { "type": "string", "pattern": "^[a-zA-Z0-9][a-zA-Z0-9._:-]+$" },
    "scopeKind": { "enum": ["workspace", "task", "subject"] },
    "taskId": { "type": ["string", "null"], "pattern": "^[a-zA-Z0-9][a-zA-Z0-9._:-]+$" },
    "subjectId": { "type": ["string", "null"], "pattern": "^[a-zA-Z0-9][a-zA-Z0-9._:-]+$" },
    "controlRevisionId": { "type": ["string", "null"], "pattern": "^[a-zA-Z0-9][a-zA-Z0-9._:-]+$" },
    "identity": {
      "type": "object",
      "additionalProperties": false,
      "required": ["state", "actorId", "evidenceIdentityIds", "limitedReason"],
      "properties": {
        "state": { "enum": ["authenticated", "unauthenticated", "unverified", "unavailable", "not-required"] },
        "actorId": { "type": ["string", "null"], "minLength": 1 },
        "evidenceIdentityIds": { "type": "array", "items": { "type": "string", "pattern": "^[a-zA-Z0-9][a-zA-Z0-9._:-]+$" }, "uniqueItems": true },
        "limitedReason": { "anyOf": [{ "$ref": "https://forgerail.dev/schemas/limited-reason-v1.json" }, { "type": "null" }] }
      },
      "allOf": [
        {
          "if": { "properties": { "state": { "const": "authenticated" } }, "required": ["state"] },
          "then": { "properties": { "actorId": { "type": "string" }, "evidenceIdentityIds": { "minItems": 1 }, "limitedReason": { "const": null } } }
        },
        {
          "if": { "properties": { "state": { "enum": ["unauthenticated", "unverified", "unavailable"] } }, "required": ["state"] },
          "then": { "properties": { "actorId": { "const": null }, "limitedReason": { "$ref": "https://forgerail.dev/schemas/limited-reason-v1.json" } } }
        },
        {
          "if": { "properties": { "state": { "const": "not-required" } }, "required": ["state"] },
          "then": { "properties": { "actorId": { "const": null }, "limitedReason": { "const": null } } }
        }
      ]
    },
    "authorizationClaim": { "const": false },
    "capabilities": {
      "type": "array",
      "minItems": 1,
      "items": {
        "type": "object",
        "additionalProperties": false,
        "required": ["capability", "state", "requiresIdentity", "sideEffectKinds", "approvalRequirementIds", "evidenceIdentityIds", "limitedReason"],
        "properties": {
          "capability": { "enum": ["source-observation", "evidence-observation", "authority-observation", "read", "write", "side-effect", "trust-observation", "freshness-observation", "revocation-observation"] },
          "state": { "enum": ["supported", "profile-only", "degraded", "blocked", "unavailable", "unknown"] },
          "requiresIdentity": { "type": "boolean" },
          "sideEffectKinds": { "type": "array", "items": { "type": "string", "minLength": 1 }, "uniqueItems": true },
          "approvalRequirementIds": { "type": "array", "items": { "type": "string", "pattern": "^[a-zA-Z0-9][a-zA-Z0-9._:-]+$" }, "uniqueItems": true },
          "evidenceIdentityIds": { "type": "array", "items": { "type": "string", "pattern": "^[a-zA-Z0-9][a-zA-Z0-9._:-]+$" }, "uniqueItems": true },
          "limitedReason": { "anyOf": [{ "$ref": "https://forgerail.dev/schemas/limited-reason-v1.json" }, { "type": "null" }] }
        },
        "allOf": [
          {
            "if": { "properties": { "state": { "const": "supported" } }, "required": ["state"] },
            "then": { "properties": { "evidenceIdentityIds": { "minItems": 1 }, "limitedReason": { "const": null } } }
          },
          {
            "if": { "properties": { "state": { "enum": ["profile-only", "degraded", "blocked", "unavailable", "unknown"] } }, "required": ["state"] },
            "then": { "properties": { "limitedReason": { "$ref": "https://forgerail.dev/schemas/limited-reason-v1.json" } } }
          }
        ]
      }
    },
    "observedAt": { "type": "string", "format": "date-time" },
    "sanitized": { "const": true }
  },
  "allOf": [
    {
      "if": { "properties": { "scopeKind": { "enum": ["task", "subject"] } }, "required": ["scopeKind"] },
      "then": { "properties": { "taskId": { "type": "string" }, "controlRevisionId": { "type": "string" } } }
    },
    {
      "if": { "properties": { "scopeKind": { "const": "subject" } }, "required": ["scopeKind"] },
      "then": { "properties": { "subjectId": { "type": "string" } } }
    }
  ]
}
